{
  "$schema": "https://json-schema.org/draft/2020-12/schema",
  "title": "decisions",
  "type": "object",
  "properties": {
    "id": {
      "type": "string",
      "minLength": 1,
      "pattern": "D-[A-Za-z0-9_-]+"
    },
    "created_at": {
      "type": "string",
      "minLength": 1
    },
    "title": {
      "type": "string",
      "minLength": 1
    },
    "context": {
      "type": "string",
      "minLength": 1
    },
    "decision": {
      "type": "string",
      "minLength": 1
    },
    "alternatives": {
      "type": "array",
      "items": {
        "type": "string",
        "minLength": 1
      },
      "uniqueItems": true,
      "minItems": 1
    },
    "owner": {
      "type": "string",
      "minLength": 1
    },
    "status": {
      "type": "string",
      "enum": [
        "proposed",
        "active",
        "superseded"
      ]
    },
    "superseded_by": {
      "type": [
        "string",
        "null"
      ]
    },
    "paths": {
      "type": "array",
      "items": {
        "type": "string",
        "minLength": 1
      },
      "uniqueItems": true,
      "minItems": 0
    },
    "checks": {
      "type": "array",
      "items": {
        "type": "string",
        "minLength": 1
      },
      "uniqueItems": true,
      "minItems": 0
    }
  },
  "required": [
    "id",
    "created_at",
    "title",
    "context",
    "decision",
    "alternatives",
    "owner",
    "status",
    "superseded_by",
    "paths",
    "checks"
  ],
  "additionalProperties": false
}
